{
  "task_id": "add_pine_tree_left_of_cabin_001",
  "operation": "create",
  "input_plan_path": "fixtures/normalized_plans/add_pine_tree_left_of_cabin_001.normalized.json",
  "expected_checks": {
    "category": "tree",
    "instance_count": 1,
    "part_count_min": 1,
    "required_materials": ["wood"]
  }
}
